,keyword,original_text,time
60.0,聯發科,文洪寶山從第一季財報顯示產業並沒有受到疫情影響聯發科與高通的財報都是優於市場預期中國大陸的基地台截至目前已建成萬個套餐用戶超過五千萬人由於各家供應商的技術目前尚不能兼容因此如果在一個地區安裝了華為的天線那麼愛立信設備就無法在此區域通用反之亦然東西方科技發展加速分道揚鑣這就是為什麼儘管美國總統川普積極要求西方國家不要用華為的設備但包括英國德國西班牙在內的西方國家還是採用華為系統誠如德國最大通信運營商德國電信表示如果排除華為則德國電信無法快速解決信號覆蓋問題但同時間主要競爭對手英國的與西班牙電信已明確表示將會採用華為的設備對德國電信而言時間正在耗盡可想而知歐盟將會採用華為的系統而美國一定不會用華為的系統東西方的科技發展分道揚鑣或許就從這場疫情開始請繼續往下閱讀中國蘇州試行數位貨幣如果不採用華為的基地台解決方案則世界各國的發展將落後於中國大陸這意味著在人工智慧與物聯網領域將由中國大陸獨佔鰲頭事實上中國大陸的蘇州已經開始試行人民銀行發行的數位貨幣上個月富邦華一銀行已經通知客戶不再執行現金收付業務但如果採用華為的解決方案則擔心個資洩漏尤其是最近被發現將加密資料回傳中國大陸更是強化了美國的疑慮川普正積極的阻擋台積電幫華為代工市場普遍認為如果華為得不到台積電的代工則發展就會受阻事實上如果美國真的強力要求台積電提供給華為海思的半導體技術含量從下調至最先受到衝擊不是台積電自主研發比重甚高的奈米奈米等先進製程而是成熟量能龐大的或奈米製程奈米是台積電南京廠主力這部分其實中芯國際已經達到奈米有能力承接轉單再加上川普對華為的態度讓中國大陸半導體業者加速去美化的國產替代儲存商機中芯國際提高資本支出以中芯國際為例年資本支出億美元年億美元增加但年受到疫情影響就連台積電也僅增加的資本支出而中芯國際卻打算增加到億美元增加無懼全球經濟衰退的逆風靠的就是中國每年億美元的市場其中的一千億美元是本土自用的記憶體儲存市場另一千億美元是在中國大陸製成運送到海外如果沒有了台積電的七奈米代工當然就給了高通機會追趕華為避免發生斷貨危機不斷備妥預防措施及準備首先華為加速在台積電生產的晶片並盡量轉到南京吋廠生產奈米奈米製程同時高端製程技術七奈米仍在台積電台灣的吋廠生產製造再來就是華為著手擴大在中芯國際的新產品數量和種類尤其是在高端技術奈米和兩個製程世代上以分散生產製造的風險以目前中芯國際的奈米的參數來看實際上就是台積電和三星的奈米節點因為它只提升了的性能遠低於台積電計畫的三和實際的業界現在以為市場基準中國突破美國半導體封鎖露曙光奈米更像三星的第二代奈米和第三代奈米就是奈米至少差了台積電的七奈米兩個世代以上但關鍵在於給了中國大陸突破美國的半導體封鎖已經有了曙光當然為了避免美國在半導體設備上的限制中芯國際的梁孟松表示對於和成本更低不會使用極紫外光方案當準備就緒時的部分層將會使用也就是說既然不用能美國或荷蘭的光刻機那就另闢途徑在時間上勉強可以趕在川普連任美國總統的年底製程可正式小量量產中芯國際公布了十四奈米製程產能的擴產計畫月到九千片月朝一萬五千片邁進這展望成為五月法說會上檢視的重點也成為中芯國際的股價能不能站上港元突破年底部的頸線壓力關鍵保護主義抬頭全球供應鏈重置在中美貿易戰與疫情的影響下過去三十年全球供應鏈高度分工的各不侵犯核心利益的默契已被破壞在保護主義抬頭的重置供應鏈比重各國勢必強化自身不足的項目於是一個世界兩套標準已成事實歐盟大國表態採用華為系統加上歐盟大國已經表態採用華為的系統如果華為的手機銷售量再拿下全球第一的話那麼科技話語權的地位就更加提高但是華為與中芯國際越強越加深西方國家的排華情緒尤其是在歐美疫情逐漸受控制後以美國為首的五眼聯盟開始針對疫情的損失發起對中國大陸索賠雖然中國大陸不可能乖乖付出代價但是很有可能在中美貿易第二階段的談判加入新的談判條件高關稅加速全球產業鏈分工重組事實上川普已經發出警告如果中國大陸沒有依約購入億美元的美國商品與服務他將會終結彼此敲定的第一階段貿易協議並且美國國土安全部的四頁情資報告指出中國大陸掩蓋了疫情以及這種病毒的高度傳染力目的就是為了抓緊時間提前囤積防疫所需的醫療用品目前川普的幕僚團正在討論如何討回公道力道與時機的拿捏等內容可以推測完整的方案應該會在六月底之前拍板定案中國大陸的兩會之後股東會旺季短線籌碼軋空行情進入初夏氣溫明顯回升到至度白天高溫動輒超過度但看到長年處在熱帶的新加坡疫情依然嚴峻可知道新冠病毒並不會因為天熱而消失甚至還要提防因鬆懈而造成秋冬的大反撲從這角度就不難理解五月四日台股加權指數大跌點但防疫概念股逆勢大漲尤其融券增加的恆大康那香熱映等三劍客更是這波軋空的指標股由於六月是股東會的旺季融券有被迫回補的壓力很有可能五月份會出現過去名不見經傳的低價股走出一波籌碼軋空行情畢竟大盤指數面對年線一萬一千點整數關卡似乎需要一點時間來化解恰逢第一季財報公布時期低價炒作的熱情有機會階段性串場一下可追蹤中化生廣錠盛弘毛寶熱映撼訊光鋐明泰恆大康那香等更多精采內容請見理財周刊期便利商店及各大書店均有販售,2020年05月08日 17:43
62.0,聯發科,上緯控投董事長蔡朝陽圖資料照記者陳心怡台北報導臺灣證券交易所櫃買中心日前公布年上市櫃公司平均薪資費用上緯投控以萬元奪下平均員工薪資冠軍也是上市櫃公司唯一一家登上萬元級的超級幸福企業另外也多達家公司平均員工薪資達萬元以上根據統計上市公司以上緯投控平均每位員工薪資費用達萬元高居第一其次是三商萬元第三華固萬元四到十名為永豐餘萬元鴻準萬元精成科萬元勤益控萬元聯發科萬元旭隼萬元及瑞昱萬元請繼續往下閱讀高於萬元的公司還包括遠雄港萬元鴻海萬元群光萬元和泰車萬元南僑萬元愛山林萬元長華萬元日月光投控萬元祥碩萬元創意萬元永信萬元可以發現到在家年薪萬元的公司當中電子占家傳產家而金融業完全沒入列金控公司平均員工薪水第一名是中信金的萬元排第名至於蘋概三王中台積電平均每位員工薪資費用僅有萬元大立光萬元鴻海萬元上市公司員工平均薪資前十高圖記者陳心怡製表過期票券別浪費簡單步驟教你搶救妙招,2020年06月02日 09:49
63.0,聯發科,大陸全國人大會議提出將港版國安法列為全國性法律在香港實施中央可在港設立國安機構引起香港社會巨大反彈圖路透社以下皆同政治中心綜合報導港版國安法預計於日在大陸全國人大會上進行審議許多港人對香港的前景感到擔憂已開始規劃移民根據台灣香港澳門居民進入台灣地區及居留定居許可辦法香港澳門人民若想申請在台灣居留其實有種方式包括最廣為人知的在台投資萬以上還有依附親人在特殊領域有成就者香港去年爆發反送中運動引發港人對政府的不信任不少人選擇移居台灣根據內政部移民署統計資料香港去年來台居留人數達到人但今年截至月申請居留人數已經突破人再隨著中國大陸全國人大日將審議香港版國安法讓港人擔憂一國一制來臨移民台灣再度成為關注焦點內政部不排除未來申請居留港人人數仍會持續增加根據香港澳門居民進入台灣地區及居留定居許可辦法第條規定港澳居民有種方式可以來台申請居留條件如下一其直系血親或配偶在台灣地區設有戶籍但其親屬關係因收養發生者應存續年以上二香港或澳門分別於英國及葡萄牙結束其治理前參加僑教或僑社工作有特殊貢獻經教育部或行政院大陸委員會會同有關機關審查通過三在特殊領域之應用工程技術上有成就四具有專業技術能力並已取得香港或澳門政府之執業證書或在學術科學文化新聞金融保險證券期貨運輸郵政電信氣象或觀光專業領域有特殊成就五在台灣地區有新台幣萬元以上之投資經中央目的事業主管機關審查通過或在台灣地區以創新創業事由經中央目的事業主管機關審查通過六在國外執教研究新興學術或具有特殊技術與經驗經中央目的事業主管機關核准七經中央目的事業主管機關核准來台就學或其畢業回香港或澳門服務滿年八經中央勞動主管機關或目的事業主管機關許可在台灣地區從事就業服務法第四十六條第一項第一款至第七款或第十一款工作或依取得華僑身分香港澳門居民聘僱及管理辦法或外國人才專法第二十條準用同法第五條第六條第一項第七條第八條及第十條規定許可工作九其他經政府機關或公私立大專校院任用或聘僱十對政府推展港澳工作及達成港澳政策目標具有貢獻經行政院設立或指定機構或委託之民間團體出具證明並核轉行政院大陸委員會會同有關機關審查通過十一有本條例第十八條之情形經行政院大陸委員會會同有關機關審查通過十二在台灣地區合法停留年以上且每年居住超過日並對國家社會或慈善事業具有特殊貢獻經主管機關會商有關機關審查通過十三經中央勞動主管機關許可在台灣地區從事就業服務法第四十六條第一項第八款至第十款工作十四其配偶為經核准居留之台灣地區無戶籍國民或經核准居留或永久居留之外國人或經核准長期居留之大陸地區人民但該配偶係經中央勞動主管機關許可在台灣地區從事就業服務法第四十六條第一項第八款至第十款工作者或經中央目的事業主管機關核准來台就學者不得申請十五來台傳教弘法或研修宗教教義經主管機關會商相關目的事業主管機關審查通過十六經行政院許可香港或澳門政府在台灣地區設立機構之派駐人員及其眷屬另外根據香港澳門居民進入台灣地區及居留定居許可辦法第條規定香港或澳門居民申請在台灣地區居留應準備下列文件向移民署申請包括居留申請書香港或澳門永久居留資格證件保證書但符合前條第一項第七款規定經中央目的事業主管機關核准來台就學或第十六款規定者免附最近五年內警察紀錄證明書但經移民署許可免附者免附健康檢查合格證明以及其他相關證明文件前項第五款健康檢查合格證明其應包括項目準用中央衛生主管機關訂定的健康檢查證明應檢查項目表第一項應備文件依外國人才專法第二十條準用同法第八條規定申請就業金卡者免附第三款至第五款之文件但依其他主管機關之規定應檢附者從其規定而總統蔡英文也在日受訪時提及已在上午與行政院長蘇貞昌進行討論且達成共識針對對香港人提出人道救援行動方案這個專案會由陸委會負責規劃並且跨部會協調專案希望陸委會在最短時間提出他們的規劃以及對社會大眾說明蔡英文也強調港人入台灣安置就業等會有專案來處理這件事情我們照顧香港人民的決心不變我們會提供他們必要的協助讓他們到台灣來居留生活還有工作其他人也看了這些蔡英文宣示人道救援香港方向讓香港人在台居留生活工作外交部若港版國安法通過美國可能取消香港優惠關稅地位蔡英文力挺香港人陸委會主責提出人道救援行動方案更多熱門新聞總統府已有香港人移民來台黎智英若申請有機制可辦理吳釗燮不知推港版國安法下一步憂心可能對台動武反送中之後港人居留台灣增加移民詢問度暴增倍上網登錄過期票券現賺倍東森幣好康來了過期票券換東森幣舉凡餐券住宿券券等過期票券都可以起死回生兌換東森幣加碼倍這麼好康的事到底要怎麼做呢首先最重要的是把家中的過期票券找出來進入東森購物的頁面輸入會員帳號及密碼就會出現票券驗證的畫面接下來只要依序填寫禮券編號條碼序號並選擇信託銀行就驗證成功囉快點連結,2020年05月27日 16:45
64.0,聯發科,圖文鏡週刊高雄市長韓國瑜罷免投票倒數個月韓陣營反制罷免的策略尚未拍板但態勢由低調轉趨強勢壓制罷韓團體可能與國民黨內部最新出爐的民調有關該項調查有近成的高雄市民願意在月日出門投票顯示韓營之前對罷免案採取低調的作法並未發揮作用藍營內部評估在可能衝破罷免門檻的高投票率下韓營最後關頭不排除祭出動員投票以爭取挺藍勢力回流與罷免派正面對決武漢肺炎疫情未歇高雄市長韓國瑜日實施兵推演練在四維鳳山行政中心動員餘人模擬社區感染情境測試各單位應變能力但另方面罷韓團體則質疑韓大動作兵推只是為反制罷韓出招讓韓在演習結束後一度耐不住性子反批市府做任何事都被扣到罷韓投票這樣的想法太偏狹防禦罷免步調混亂距離罷韓投票僅剩一個月韓國瑜的市長保衛戰已到最後關頭但韓營與國民黨中央至今卻仍未定調這場投票是投或不投讓挺韓的支持者焦慮不堪本刊調查藍營高層研判罷韓在疫情期間未見冷卻黨雖多次透過管道建議韓營採取積極的防守策略反制但韓營對最後階段該採取何種策略是冷處理或高調回擊內部始終有二派不同看法正反意見至今持續拉扯讓韓營的防禦罷免步調顯得十分混亂知情人士透露藍營內部日前針對罷韓議題做民調為降低政治性命題方式還經過特別設計將中央防疫成效與罷韓等議題交互融入提問中藉此提高受訪者對民調的信任度但讓藍營人士訝異的是這份設計過的民調顯示仍有近的高雄市民有意出門參與罷韓投票已遠遠超過罷免成立所需的投票門檻看板大戰棄冷處理據藍營人士觀察該份民調之所以投票率偏高主要是因韓營尚未向支持者說明是否要投反對票但從先前韓營主動祭出法律戰反制罷免到近日韓公開為夫人李佳芬遭質疑介入市政展開反擊似有意直接與罷韓團體正面對決的趨勢防止罷免案過關該人士說韓營的策略包括持續打防疫牌且以避免群聚為由減少學校出借罷韓投票場地以及在藍營議會席次的優勢下沒收臨時會並技巧性地幫韓在罷韓投票前躲過議會總質詢等都可看出韓營為反制罷免案的用心不過該人士也說無論韓營再如何低調如何冷處理表態願意去投票的從罷免成案後就從沒低過面對此一趨勢韓營不得不思考轉趨高調主導反制罷韓策略但這過程黨中央反而一直插不上手該人士指出從近日韓市府與罷韓團體的看板大戰可看出韓營對罷免案已逐漸放棄冷處理但這究竟是福是禍唯有票投出來才可論斷不過從民調趨勢看來似與韓營的作法背道而馳的確令人憂心挺韓陣營陷低氣壓對此親韓人士則表示與其坐以待斃等待罷免案過關市府高層也必須做好回擊準備在最後階段不排除動員挺韓民眾參與投票但這個選項只是先備而不用否則過早動員只會替罷韓團體拉高聲量而已該人士透露雖然韓營至今未定調是否動員投票但近日內部也開始啟動戰略布局包含透過國民黨立法院黨團發動交通委員會南下考察愛情摩天輪的行程以及私下與黨內具聲望的民意代表接觸商討選前助選方案都在為日後動員埋下伏筆此外韓營近日也積極安撫基層情緒特別是與先前暗地倒戈加入罷韓連署的藍營民代私下溝通盼化解不滿但讓韓始料未及的是一波未平一波又起向來被視為挺韓最力的黃復興黨部最近卻集體陷入低氣壓狀態對挺韓也感到意興闌珊原因則指向江啟臣月上旬簽派的黨務人事案一位南部的退役軍系大老向本刊表示黨主席江啟臣任命新任黃復興黨部主委臧幼俠後引起各地軍系強烈反彈主因除了臧僅是少將退伍打破黃復興過去由上將領導的慣例讓所有退役高階幹部更不滿的是在人事交接前一天才臨時收到黨中央以通知任期到當晚零時停止連給人收東西的時間都沒有簡直粗暴臨陣換將折損戰力該名大老還指出臧啟用的支黨部主委多屬他親近的後備軍人系統未顧及軍種比例與地方特性在新任的位黃復興支黨部主委中海軍空軍僅各有一位另以高雄為例因在地海軍人數多過去長期由海軍的退役軍人擔任支黨部主委但此次卻由後備系統的廖使賢出線與在地連結不深在罷韓投票之前短時間內能整合軍心嗎恐怕非常不樂觀一位不願具名的黃復興幹部表示過去黃復興黨員只要黨中央下達選舉指示都會使命必達但在這波人事更換後不少人對黨已心灰意冷若接下來要為反罷韓動員雖然黃復興有不少人支持韓國瑜但也有人不是韓的鐵粉那為什麼還要聽黨中央的指揮臨陣換將是兵家大忌罷韓對決前大動人事戰力不折損才怪該名幹部說曾有人建議黨中央應在罷免投票結束後再更換高雄支黨部主委但意見未被採納如今罷韓來勢洶洶藍營要怎麼整合地方士氣並穩定在地軍心避免引發出走潮實在令人擔憂對於黃復興內部因人事更迭出現雜音藍營人士認為黃復興黨部的戰力看似逐漸疲弱但仍是藍營動員力最強的部隊影響力也不局限於黨內選舉黨中央應盡力溝通消弭異音江啟臣在證明自己是能開創新局的黨主席前恐怕要先指揮這批大軍挺過罷韓硬仗眾人都正張大眼睛在看更多鏡週刊報導全文冒名李嘉誠詐上萬口罩黃琪涉駭台大扮名醫行騙全文搶小時斬斷病毒傳播鏈揭疫調三度進化內幕全文提案修會計法赦免法綠委救扁雙箭齊發,2020年05月10日 08:21
65.0,聯發科,記者林淑慧台北報導新冠肺炎疫情趨緩各國解封措施即將上路推升國際油價上漲專家預估下周國內汽柴油零售價格每公升各調漲及元為國內油價連續四周調漲提醒民眾把握周末時間加滿愛車油箱才能替自己省點荷包產油國沙國月加碼減產中油宣佈國內汽柴油零售價格明天起再度調漲圖記者姜國輝攝請繼續往下閱讀據浮動油價調整機制作業原則調整後的參考零售價格分別為無鉛汽油每公升元無鉛汽油每公升元無鉛汽油每公升元超級柴油每公升元台灣中油表示本週受美國本土頁岩油產量將創年新低全球新冠肺炎疫情有趨緩跡象等因素影響帶動國際原油價格上漲本週調價指標週均價為每桶美元較前週美元上漲美元新臺幣兌美元匯率貶值元國內油價依公式計算漲幅為按浮動油價調整原則汽柴油每公升原應各調漲及元經考量亞鄰最低價限制本週汽柴油僅調漲及元另及元由台灣中油吸收調價後的各式油品參考零售價格調幅及調整金額如附表實際零售價格以各營業點公告為準過期票券別浪費簡單步驟教你搶救妙招,2020年05月24日 12:11
66.0,聯發科,臉書社團轉分享影片表示高雄市幸福川整治攏是假圖翻攝臉書社團我愛掀馬統記者吳奕靖高雄報導網友在臉書公民割草行動社團當中出了一段影片表示高雄市政府惡劣高雄市幸福川整治工程工程用黑貓清水溝攏是假影片一出讓網友紛紛崩潰開轟做表面團隊不過水利局澄清回應好比掃地時先將灰塵或垃圾集中於固定的幾處再一起處理的概念這一段影片當中就看到小山貓把沙塵推進了幸福川當中這也讓網友痛批韓國瑜砸二備金清淤被網友抓包倒黑泥進水裡惡劣高雄市幸福川整治工程工人用黑貓山貓把污泥沙推回水溝網友留言表示做表面的團隊笑死國王的新衣嗎原來第二預備金的用法是這樣子花的難怪會一直哭窮臉書社團轉分享影片表示高雄市幸福川整治攏是假圖翻攝臉書社團我愛掀馬統不過對此高雄市水利局回應為了讓幸福川清疏工作更快更有效率有時會先利用小型較有機動性的機具例如民眾所見的小山貓或利用人工的沖洗方式將幸福川寬廣渠道內的污泥先推至某區域集中或清入中央的溝內但最後這些污泥都會利用怪手再一併清除若以簡單一點的概念描述好比掃地時先將灰塵或垃圾集中於固定的幾處再一起處理的概念同時水利局也強調公民參與是城市進步改善的動力也有影片記錄整個幸福川的清疏過程並置於水利局的官網中歡迎大家一起分享幸福川清疏的成果高雄市水利局提供幸福川整治清淤圖高市水利局提供高雄市水利局提供幸福川整治清淤圖高市水利局提供,2020年05月07日 14:13
