,keyword,original_text,time
73.0,旺宏,中國兩會後投資人關注後續布局方向瑞銀也點名看好大行業發展示意圖記者任以芳攝記者紀佳妘台北報導中國在兩會上發布的財政支援規模貼近市場預期不過外界關注今年政府工作報告提出兩新一重的重點建設也就是應用的新型基礎建設新型城鎮化建設以及交通水利等重大工程建設瑞銀財富管理投資總監辦公室也看好大行業發展中國兩會後投資人關注後續布局方向瑞銀財富管理投資總監辦公室點名看好大行業發展首先是智能基建新能源汽車雲計算及資料中心等都是智慧基建的主要領域並成為中國經濟長期發展的著力點不止政策及公共資源助力新基建發展民營企業也趕緊投資相關技術研發結合形成更強的驅動力請繼續往下閱讀瑞銀指出大電信運營商今年合共預算投資逾億元於基建相關項目上全國年末前建造及運營至少萬個基站即便在疫情之下一季度已完成全年目標分之但仍會關注美國擴大對華為及其他中資網路基建供應商的科技限制對中國明年之後的中期發展部署構成風險第二為醫療健康瑞銀表示在疫情過後兩會加強公共衛生體系建設的重要性並表明要用好抗疫特別國債加大疫苗藥物及快速檢測技術研發投入等因此認為醫療設備業受益於新醫院及緊急中心建造並看好線上醫療平台創新藥品製造業及市場領導者的前景最後在大灣區瑞銀認為大灣區加快融合不單利於金融業同時支持創新科技及戰略性新產業而國家開發銀行已承諾為大灣區專案提供億元融資瑞銀分析隨著大灣區經濟不斷增長及發展進一步拉動整個地區的消費及旅遊活動澳門博彩業因此明顯受益與此同時由於跨境資本流通增加加上中概股可能回流香港二次上市鞏固香港作為國際金融中心的地位過期票券別浪費簡單步驟教你搶救妙招,2020年06月03日 10:49
74.0,旺宏,圖路透社記者余弦妙台北報導港交所昨日公布港交所旗下香港期貨交易所有限公司期交所已與簽訂協議根據協議同意授權香港期交所使用亞洲及新興市場股票指數有關指數將在香港期交所初步推出檔期貨及期權合約這項消息一出也造成新加坡交易所股價崩跌據了解這批亞洲及新興市場指數包括但不限於新興市場亞洲指數中國自由指數日本指數台灣指數也就是摩台指新加坡指數及印度指數請繼續往下閱讀香港特區政府對此大表歡迎認為可鞏固香港作為首選風險管理中心的地位並標誌着市場對政府致力加強香港作為國際金融中心地位的信心香港財政司司長陳茂波表示這項合作計劃為發展香港成為亞洲區內卓越風險管理中心和衍生工具樞紐邁出重要一步並對香港市場投下信心的一票不過另一頭對新加坡交易所來說可就不是好消息了因為這代表從明年月起雙方合約到期後將與減少合作雙方將僅在新加坡期貨及期權方面保留合作摩根大通指出的相關產品佔新交所整體衍生品交易量的比重達到約此次終止與新交所的合作將會減少新交所的衍生品交易量約導致利潤減少也因此新加坡交易所的股票昨天應聲大跌今天仍然續跌針對這項消息統一期貨投顧部經理廖恩平表示其實這項消息對台股來說不見得是壞事主要是因為與台灣有關的商品就只有摩台指但這項產品已經行之有年現在就算轉換交易所對交易模式也不會有太大影響廖恩平更提到如果外資目前移到新的交易所交易若是在操作上無法順暢操作也可能會把資金轉移到台股直接進行操作因此這項消息或許也對台股來說是相對好消息過期票券別浪費簡單步驟教你搶救妙招,2020年05月28日 14:19
75.0,旺宏,太和生技董事長郭靖凱圖記者姚惠茹攝記者姚惠茹台北報導全球化妝品製造大廠太和宣布跨領域攜手安徽德正堂藥業研發無酒精消毒類產品主要是酒精消毒類相關產品已逐漸成為疫後必需品因此太和生技集團憑藉著核心資源的研發製造技術攜手德正堂藥業加速完成消毒類產品的開發製造與抑菌認證程序太和董事長郭靖凱表示新冠肺炎仍持續延燒太和生技正式與安徽德正堂深度策略聯盟並簽屬戰略協議由於安徽德正堂擁有優厚資源的防疫產品製造商除了具備消毒產品生產企業衛生許可證可生產酒精條件的資質且為德正堂藥業國家中醫藥非物質文化遺產保護單位同時經國家批准成立皮膚抗衰研究所具備消毒滅菌產品的一類醫療輔助器械許可證請繼續往下閱讀郭靖凱指出太和生技擁有實力強大的研發團隊雙方自疫情後開始不斷的深入研討不僅將太和生技集團產品線延伸至防疫相關產品更有機會協助更多國際及中國本土美妝品牌客戶進軍防疫市場進軍天然植物功能型彩妝皮膚理療產品等做好準備創造集團整體業務接單市場範疇擴大郭靖凱進一步指出目前已與安徽德正堂一同為疫情研發款消毒噴霧以及後續防疫產品其中消毒噴霧是使用中藥草本配方和西方專利科技所有產品線使用中藥草本配方和西方專利科技同時結合緩釋藥物傳輸系統特殊發酵科技的兩大核心技術郭靖凱說明消毒噴霧不僅無酒精化工等添加更不會造成肌膚腐蝕性刺激性和異味產生且能阻斷傳播途徑預防交叉感染可有效抑菌長達小時殺菌率高達並取得藥監局產品備案字號皓六械備號食品級原料適合推薦孕婦嬰兒敏感性皮膚或皮膚抵抗力較低的消費者展望營運郭靖凱表示太和生技運用多年累計彩妝保養萬種配方獨門工藝技術以及德正堂國家械字號研發多款新藥妝護膚類產品的研發實力擴增集團多元產品線的廣度與深度可望隨著更多國際及本土知名彩妝品牌客戶對於疫情消毒類產品的需求增溫帶動公司訂單挹注整體營運過期票券別浪費簡單步驟教你搶救妙招,2020年06月03日 09:19
76.0,旺宏,左起為穎台科技董事長王志鴻總經理林俊役圖記者姚惠茹攝記者姚惠茹台北報導穎台科技今日登興櫃掛牌交易主辦輔導券商為國泰證券每股參考認購價格元掛牌首日迎接蜜月行情開盤漲幅高達穎台所生產的表面特殊結構光學板為業界首創而現今的穎台科技已成功轉型為高度客製化的有機新材料應用的領導廠商穎台科技過去曾是國內上市公司並在年中下市後針對旗下各產品和事業評估進行組織重整以及業務整頓藉由收購分割改善公司營運結構提升經營績效如今站穩全球有機新材料應用的領導廠商再度重登興櫃最快明年可上市掛牌請繼續往下閱讀穎台科技在開發複合新材料領域已深耕多年研發出多項獨具創新的材料配方專精於複合多材料特性研發並透過獨有的押出製程工藝提供品牌廠商客製開發的需求並擁有制定產品規格的能力與競爭者最大的不同係公司對材料的特性掌握配方調整及客製化能力穎台科技近年朝向多角化邁進目前所生產的產品應用範圍包括大尺寸液晶電視液晶顯示器商用大屏幕顯示器室內照明板材車用顯示器手機背蓋新材料等逐步以高附加價值產品應用為發展方向穎台科技年營收億元稅後盈餘億元元年營收億元稅後盈餘億元元穎台科技透過產品結構改善提升高毛利商品比重及有效的成本管控下毛利率及淨利率分別年增顯現整體營運績效將比以往提升展望未來穎台科技表示今年隨著產業趨勢擴散板及手機背蓋材料的市場需求增有望拉升穎台科技整體獲利未來營運表現可望持續攀升過期票券別浪費簡單步驟教你搶救妙招,2020年05月29日 09:22
77.0,旺宏,圖文鏡週刊知情人士說張國政在長榮經營權之爭中將在二個基金會董事會要求席董事全面改選目前張國明與張國政結盟對抗老大張國華與現任基金會董事長鍾德美等當權派除了張國明及張國政二人都要參選外姊夫前兆豐金控董事長鄭深池也出現在董事候選名單上本刊調查張榮發的老二張國明及老三張國政陣營在商討策略時曾有人建議和已出走的二房張國煒聯盟但張國煒在年父親張榮發過世後依據張榮發的遺囑出任集團總裁立即被大房三位哥哥掃地出門目前自創星宇航空考量與他與長榮結盟意願應不高加上老三曾對張國煒提告訴請遺囑無效也控告二房李玉美偷張榮發珍藏的人參彼此裂痕已深合作可能性低老三才峰迴路轉找回當年與父親決裂而出走的鄭深池希望逆轉勝請繼續往下閱讀知情人士表示鄭深池政商關係良好特別是與綠營的往來還曾替前第一夫人吳淑珍匯款海外遭查辦老二老三此舉應是想借重鄭深池的人脈以做公親為名助攻但當年鄭深池出走長榮時除帶走長榮航空副董事長許瑞源並一度要讓許擔任華航董事長與長榮航空打對台讓張榮發氣到發抖這回鄭深池能否獲長榮員工認同已在集團內部引發不少討論本刊調查張榮發慈善基金會席董事中有席支持老二張國明及老三張國政掌權的老大張國華僅獲席支持依據財團法人法改選董事須有人出席投票因此老二老三派欽點鄭深池出馬角逐董事希望能讓董事會變天知情人士表示張榮發慈善基金會雖僅擁有長榮國際股權但仍是關鍵少數如果鄭深池在本週五的張榮發慈善基金會中能獲選進入該基金會可能將是老二老三反攻的破口更多鏡週刊報導長榮駙馬參戰張榮發護血脈超前部署老三出招打破老爸布局長榮駙馬參戰扁朝金融帝國操盤手鄭深池受綠營重用全靠個字長榮駙馬參戰基金會董事名單獨家曝光駙馬老班底拚逆轉勝青春露超低價現省近元女星素顏保證有沒有過期的票券點這邊讓你的過期票復活,2020年05月28日 00:10
78.0,旺宏,觀光旅遊人次受到疫情衝擊下滑示意圖記者林育綾攝記者李瑞瑾台北報導中央銀行今日公布年第季國際收支其中經常帳順差億美元較上年同季增加億美元或金融帳淨資產增加億美元央行準備資產增加億美元商品貿易順差億美元較上年同季減少億美元創下年億美元季以來新低疫情蔓延衝擊全球經濟供給面及需求面加以國際原物料價格重挫年第季出口億美元較上年同季減少億美元並創下年億美元季以來新低進口億美元較上年同季減少億美元創下年億美元季以來新低請繼續往下閱讀服務收支逆差億美元較上年同季減少億美元主要係旅行收支逆差縮小央行指出受到疫情影響第一季出國人數較去年同季下降來台觀光人數也減少其中月下降幅度最為明顯拖累第一季整體數字表現第一季旅行支出為億美元創下年億美元以來新低而旅行收入億美元為年億美元以來新低旅行收支逆差縮小為億美元另外初次所得順差億美元較上年同季增加億美元主要係銀行支付國外利息減少二次所得逆差億美元較上年同季增加億美元主要係工作者匯出款增加外資大砍台股減持億美元創歷史新高紀錄過期票券別浪費簡單步驟搶救,2020年05月20日 18:59
79.0,旺宏,觀光旅遊人次受到疫情衝擊下滑示意圖記者林育綾攝記者李瑞瑾台北報導中央銀行今日公布年第季國際收支其中經常帳順差億美元較上年同季增加億美元或金融帳淨資產增加億美元央行準備資產增加億美元商品貿易順差億美元較上年同季減少億美元創下年億美元季以來新低疫情蔓延衝擊全球經濟供給面及需求面加以國際原物料價格重挫年第季出口億美元較上年同季減少億美元並創下年億美元季以來新低進口億美元較上年同季減少億美元創下年億美元季以來新低請繼續往下閱讀服務收支逆差億美元較上年同季減少億美元主要係旅行收支逆差縮小央行指出受到疫情影響第一季出國人數較去年同季下降來台觀光人數也減少其中月下降幅度最為明顯拖累第一季整體數字表現第一季旅行支出為億美元創下年億美元以來新低而旅行收入億美元為年億美元以來新低旅行收支逆差縮小為億美元另外初次所得順差億美元較上年同季增加億美元主要係銀行支付國外利息減少二次所得逆差億美元較上年同季增加億美元主要係工作者匯出款增加外資大砍台股減持億美元創歷史新高紀錄過期票券別浪費簡單步驟搶救,2020年05月20日 18:59
80.0,旺宏,左起為友訊獨立董事馮忠鵬鍾祥鳳新任董事長李中旺圖記者姚惠茹攝記者姚惠茹台北報導網通廠友訊市場派召開股東臨時會解任包含董事長胡雪在內的位董事職務並在會後召開臨時董事會推選李中旺擔任新董事長經查經濟部商業司今日已將友訊的代表人名字更換為李中旺代表月日即將登場的友訊股東會就將由李中旺主持經查經濟部商業司稍早已經將友訊的代表人由胡雪更換為李中旺並正式發文核可變更登記目前友訊董事會正式成員為李中旺鍾祥鳳馮忠鵬三人而董事長為李中旺代表月日即將登場的友訊股東會就將由李中旺主持而原公司派想保著經營權更具挑戰請繼續往下閱讀李中旺表示非常感謝經濟部及相關主管機關的快速決策及協助明日將前往友訊赴任並與前董事長進行相關交接作業雖然任期僅剩短短的天但會盡全力穩定軍心也希望月日的股東常會能順利進行選任出未來對公司有具體貢獻的董事成員李中旺最後仍不忘呼籲希望經營權紛爭就此告一段落全體同仁需審慎面對公司現況問題及未來的挑戰盡速將公司營運回到正常軌道友訊月日由獨董馮忠鵬鍾祥鳳召開股東臨時會會中以超過的股數通過解任包含董事長胡雪在內的高聚投資明泰前勁投資云瑋投資法人代表等董事職務以及獨立董事陳立君職務並在會後立即召開臨時董事會推選李中旺為新任董事長當天李中旺馮忠鵬鍾祥鳳前往友訊內湖總部卻被阻擋在外並由胡雪兒子高宏毅出面解釋新任董事長需要先到經濟部商業司進行變更登記完成之後才能依法進入公司總部因此李中旺當天下午就前往商業司登記過期票券別浪費簡單步驟教你換倍東森幣相關閱讀友訊市場派推選李中旺擔任新董事長遭公司派阻擋進入總部友訊市場派大勝股東臨時會登場胡雪等位董事遭解任,2020年06月03日 17:29
81.0,旺宏,新台幣兌美元今天以平盤元兌美元開出圖記者湯興漢攝記者李瑞瑾台北報導台北外匯市場新台幣兌美元匯率今日以平盤元兌美元開出新台幣匯率昨日收在元兌美元今天以平盤開出請繼續往下閱讀截至上午點分新台幣小幅升值來到元兌美元升值分過期票券別浪費簡單步驟教你搶救妙招,2020年05月20日 09:09
82.0,旺宏,圖文鏡週刊中部商界聞人楊得根一手打造德昌裕國集團事業版圖陸續跨足物流食品營建等領域他一步一腳印為楊家事業奠定良好基礎請繼續往下閱讀裕國董事長楊連發上週四接受本刊專訪除了說明近期發生的爭議他也介紹家族歷史我們家是彰化溪湖人父親歲帶著元離鄉背景到台中創立德昌食品賣肉乾豆干楊連發說父親楊得根打拚年買了第一棟房子因為對房地產有興趣成立德昌建設年入主裕國之後陸續跨足物流食品銷售與加工製造等領域楊得根熱愛經商為事業拚搏一生他過去常說人生因匱乏而努力做牛不怕沒田犁雖然人生艱困阻礙無所不在有如牆壁仍須秉持著無牆壁精神因此他常常告訴後代做人要有腳踏實地追根究底的精神一旦下了決心就會有方向只要一直往前走總會有出路楊連發透露爸爸事業心重畢業後跟在他身邊快年印象中都是在談事業隨著工作經驗多我也越來越有主見每次我們意見不合他就要我到外面自己闖不過現在回想起來很感謝爸爸的訓練楊得根一輩子努力打拚旗下事業包含德昌裕國大集團加計各公司營收名下土地資產等外界估計其身價達百億元但楊得根年月驟逝因為走的突然沒有留下遺囑目前後代為了遺產爭吵不休公司也爆發經營權爭奪戰更多鏡週刊報導冷凍龍頭兄弟鬥家族事業三進三出他每次回鍋都當救火隊冷凍龍頭兄弟鬥直擊姪子妹婿上門逼宮德昌家族內鬨搶裕國經營權冷凍龍頭兄弟鬥裕國冷凍董座鬧雙胞姊弟結盟圍攻長兄美容大王夏日鎮靜神水超低價免費送眼霜有沒有過期的票券點這邊讓你的過期票復活,2020年06月03日 20:28
83.0,旺宏,宏碁消費筆電銷售在美創新高圖宏碁提供記者姚惠茹台北報導宏碁今日宣布根據最新市調資料顯示宏碁月在美國消費筆電市場方面年增達創新高更遠高於業界均值位居各家電腦品牌之冠並在美國所有個人電腦市場銷售穩健成長躍升為美國前三大個人電腦品牌宏碁表示美國消費筆電月年增創新高並以市佔率排名第三同時在美國包含筆電桌機的所有個人電腦市場銷售年增率達並以市佔率躍升為美國前三大個人電腦品牌宏碁指出受惠防疫在美國市場抓準機會滿足消費者在月份居家及遠距工作的需求讓消費市場趁勢在月份獲得佳績此外宏碁強調因應市場的多元需求宏碁在美國消費市場月份以的成長大幅領先更以市佔率衝上冠軍寶座取得美國消費市場領先地位請繼續往下閱讀過期票券別浪費簡單步驟教你搶救妙招,2020年06月03日 14:32
84.0,旺宏,工商協進會理事長林伯豐資料照記者湯興漢攝記者余弦妙台北報導工商協進會今日上午召開理監事會議會前工商協進會理事長林伯豐受訪時指出台灣下半年經濟要恢復只靠振興券是不夠的台灣人口內需市場小不足以支撐台灣要跟全世界做生意才是正確方向根據行政院目前所規劃的振興券主打民眾只需花千元政府將補貼元預計這項措施將在月中上路請繼續往下閱讀對此林伯豐表示政府發放振興券的確會有正面效益雖不如發現金來的實際不過既然政策已定那政府應該要盡快上路目前月才剛開始政策要等到月中才會上路似乎有點晚況且對於到時候振興成效到底多高仍無法預估個人預估應該是不太樂觀林伯豐進一步指出主要還是台灣內需市場不夠大若是想讓台灣經濟可以全面復甦還是要做全世界的生意因此預估下半年台灣經濟仍無法像先前國發會所說的可以復甦主要視疫情影響到的是整體營運環境訂單都要重新爭取市場要重新活化這些都需要年左右的時間短期間景氣實在無法回到去年的情況因此林伯豐也強調台灣需要與世界接軌尤其是要盡快加入同時台灣大企業也都到美國投資了應該趕緊與美國洽簽過期票券別浪費簡單步驟教你搶救妙招,2020年06月03日 13:54
85.0,旺宏,勞動部公布最新紓困貸款人數圖記者李毓康攝記者余弦妙台北報導勞動部因應新冠肺炎疫情推出勞工紓困貸款萬元共萬個名額根據勞動部今日公布最新數據顯示勞工貸款自開辦以來至今累積受理申貸件數已經達萬件勞動部表示因名額已滿今下午時起銀行不再受理根據勞動部最新統計指出目前成功核貸的人數有萬件而入帳數則有萬件請繼續往下閱讀勞動部表示已申請的人約有到遭銀行拒絕放貸因此從目前申請件數中扣除後不符合申貸條件者後考量名額已滿因此今下午時起各家配合銀行不再受理申請線上申請也同步停止至於超出名額的部分勞動部則是回應所需的資金及補貼利息將由勞動部另行協調銀行及籌措經費勞動部指出只要是年滿歲且為本國籍勞工每人貸款額度最高萬元貸款期限年由信保基金提供成信用保證貸款利率按中華郵政二年期定期儲金機動利率加百分之一計算目前為勞動部補貼第年貸款利息貸款第年前個月為寬限期勞工無須繳納本金第個月至第個月攤還本金第年起按月攤還本金及利息勞動部表示有意願申請的勞工可從承貸銀行中選擇平日有往來的銀行申請辦理較為便捷申請人向銀行臨櫃或線上申請時備妥身份證件填具銀行申請書聲明書參加勞工保險的勞工不須再檢附工作證明文件未參加勞工保險的勞工可檢附相關工作事實資料如工作收入證明等過期票券別浪費點這邊幫你搶救變身,2020年06月03日 17:25
86.0,旺宏,後疫情時代經濟部團隊規劃振興三倍券等多元方案刺激消費圖經濟部提供記者林淑慧台北報導行政院今日宣佈振興三倍券方案經濟部表示月日起民眾就可以開始預購紙本或綁定數位支付工具來使用振興三倍券其中紙本預購分為兩階段月日至日可持健保卡至四大超商或上網插卡預購並繳費預計月日至月日開始第二階段的預購為協助因疫情影響而受衝擊店家行政院今天發布振興三倍券實施內容秉持好領好用好刺激三好一溫暖特色鼓勵民眾走出門消費購物針對弱勢族群政府也主動匯入元給他們兌領振興三倍券讓全國民眾都能到實體店家體驗消費振興經濟請繼續往下閱讀後疫情時代經濟部團隊規劃振興三倍券等多元方案刺激消費圖經濟部提供另外選擇行動支付電子票證與信用卡之民眾可於月日至月日期間先上網登錄綁定數位工具月日起至年底至實體店家使用累計滿元可透過行動支付帳戶電子票證至超商靠卡信用卡抵扣帳單的方式領回元等於自己只要負擔元政府幫你出元一樣可享受到的消費振興三倍券一千變三千在全國實體店家都可使用無論護髮美甲百貨公司餐廳書店演唱會夜市市場與旅遊住宿等可以消費讓民眾好用但不能用於電商網購繳稅罰單規費菸品保單股票國民年金信用卡卡費禮券儲值過期票券別浪費簡單步驟教你搶救妙招,2020年06月02日 18:44
87.0,旺宏,圖文鏡週刊國內最大低溫倉儲業者裕國冷凍第二代兄弟鬩牆今年月弟弟楊長杰陣營發動奇襲宣稱改派裕國大股東德昌國際法人代表要將哥哥楊連發拉下董座家族內鬨浮上檯面上週四月日楊長杰一方拿出台中地院裁定帶隊欲接管公司行使董事長總經理職權雙方爆發爭議楊連發當天接受本刊專訪表示用掠奪的方式大家應該不會認同要做對的事相信老天爺自有他的主張楊連發年前回來接裕國董座但大動作改革引發家族成員不滿圖鏡週刊提供下同請繼續往下閱讀上週四月日本刊現場直擊一名梳著油頭年約的男子與一名身形瘦高年紀較長的男子領著律師團及數名人員不顧保全警衛阻攔大喇喇走進裕國冷凍以下簡稱裕國台中總公司大批人馬抵達一樓大廳後帶頭的名男子不發一語坐在一旁律師手上拿了一份資料大聲疾呼現在我們要行使董事長總經理職權接下來要辦理人事交接接管公司眼見身分不明之人強行進入在場的員工連忙知會主管並拿起電話報警裕國董事長楊連發得知後也立馬找來委任律師現場氣氛緊張其實帶頭的年輕男子是裕國第二代楊長杰之子楊育偉要叫楊連發一聲阿伯另名帶頭的則是楊連發的妹婿詹義郎二人宣稱是裕國新任董事長和總經理要接管公司準備拉下現任董座楊連發裕國是國內最大低溫倉儲業者年德昌食品創辦人楊得根入主後事業版圖陸續跨足物流食品營建等領域近年營收皆超過億元楊得根年月驟逝家族成員協議由長子楊連發負責裕國營運次子楊長杰長掌管德昌食品未料今年公司董監改選前夕竟爆發經營權之爭面對姪子妹婿逼宮鮮少在媒體曝光的楊連發上週四首度打破沉默接受本刊專訪我本來也想說不要爭了會跳出來是因為捨不得公司員工他還強調用掠奪的方式大家應該不會認同要做對的事相信老天爺自有他的主張更多鏡週刊報導冷凍龍頭兄弟鬥裕國冷凍董座鬧雙胞姊弟結盟圍攻長兄冷凍龍頭兄弟鬥妹婿嗆大哥賭歹筊楊連發喊冤還原始末冷凍龍頭兄弟鬥父親遺產喬不攏長兄控她手握把柄威脅謀產,2020年06月03日 07:53
